technique,description,complexity,effectiveness,detection_bypass
word_swapping,Replaces common security terms with business jargon,1,0.75,0.65
synonym_injection,Adds legitimate business context around suspicious elements,2,0.85,0.70
zero_width_chars,Uses invisible unicode characters for obfuscation,3,0.90,0.80
word_swapping,Transforms text to match corporate email style,1,0.70,0.60
synonym_injection,Embeds content within legitimate-looking updates,2,0.80,0.75
zero_width_chars,Manipulates spacing and formatting,3,0.95,0.85
